{
  "condition_id": "urn:telic:hi7:condition:b5bc26c3-230a-5163-9022-39fd9d5d30a8",
  "assembly": "urn:telic:hi7:assembly:912f2d52-7eac-52fb-a986-f281174475aa",
  "condition": "No route may create a period without minimum urgent-care access for residents unable to reach the regional hospital.",
  "protected_for": [
    "urn:telic:hi7:center:8d6f9719-9314-5597-9e74-d6e89bc55b9a",
    "urn:telic:hi7:center:1e203bdf-653b-5088-a82b-960512f648be",
    "urn:telic:hi7:center:a50e2197-5df2-57c6-aeb2-0b7096266beb"
  ],
  "source": {
    "basis": [
      "county health duty",
      "accessibility obligations",
      "patient evidence"
    ]
  },
  "scope": {
    "service": "urgent outpatient access",
    "duration": "transition and implementation"
  },
  "evidence": [
    "transport assessment",
    "patient testimony",
    "emergency diversion data"
  ],
  "authority": {
    "holder": "county health authority with public oversight"
  },
  "override_process": {
    "ordinary_weighting": false,
    "required": "formal legal and protected-condition review"
  },
  "review": {
    "trigger": "transport or service conditions materially change"
  },
  "status": "active"
}
